Name,Website,Phone,Industry
Mobile Car Wash Tampa by Fred’s Mobile Detailing,https://www.bestmobilecarwash.com/,(813) 635-6160,"Automotive Industry, Cleaning Services"
Mobile Auto Detailing Solutions,http://autodetailingsolution.com/,(813) 593-1105,"Automotive Industry, Cleaning Services"
The J&B Mobile Detailing,No website,(239) 462-0707,"Automotive Industry, Cleaning Services"
Clean AF Mobile Car Detailing,https://cleanafmobiledetailing.com/,(813) 337-7642,"Automotive Industry, Cleaning Services"
Fred's Mobile Auto Detailing of Tampa,https://www.bestmobilecarwash.com/,No phone,"Automotive Industry, Cleaning Services"
Pitstop Mobile Detailing,https://www.pitstopmobiledetailing.net/,(702) 300-0949,"Automotive Industry, Cleaning Services"
Blue Diamond,No website,No phone,"Automotive Industry, Cleaning Services"
Legit Mobile Detailing,http://www.legitmobiledetail.com/,(413) 405-1213,"Automotive Industry, Cleaning Services"
Shine On Time Details,http://www.shineontimedetails.com/,(813) 712-9315,"Automotive Industry, Cleaning Services"
Imperium mobile detailing & Ceramic Coating,https://imperiumtampamobiledetailing.com/,(813) 562-7202,"Automotive Industry, Cleaning Services"
